{
  "$schema": "https://json-schema.org/draft/2020-12/schema",
  "$id": "https://3iq.io/design-system/tokens.schema.json",
  "title": "3iQ design tokens",
  "description": "Shape of tokens.json. Kept intentionally loose — enforces presence of major sections, names for semantic colour roles, and hex format for swatches. Does not exhaustively type every value.",
  "type": "object",
  "required": ["brand", "color", "typography", "size", "gradient", "logo", "voice", "disclaimer"],
  "additionalProperties": true,

  "$defs": {
    "hex": {
      "type": "string",
      "pattern": "^#([0-9A-Fa-f]{6}|[0-9A-Fa-f]{8})$",
      "description": "6- or 8-digit hex colour (uppercase preferred)."
    },
    "rem": {
      "type": "string",
      "pattern": "^-?\\d+(\\.\\d+)?rem$"
    },
    "cssLength": {
      "type": "string",
      "pattern": "^-?\\d+(\\.\\d+)?(rem|px|em|%|vw|vh)$"
    },
    "gradient": {
      "type": "string",
      "pattern": "^(linear|radial|conic)-gradient\\("
    },
    "colorRole": {
      "type": "object",
      "required": ["bg", "surface", "text", "text_muted", "border", "cta_text", "accent", "rule"],
      "properties": {
        "bg":         { "anyOf": [{ "$ref": "#/$defs/hex" }, { "const": "transparent" }] },
        "surface":    { "$ref": "#/$defs/hex" },
        "text":       { "$ref": "#/$defs/hex" },
        "text_muted": { "$ref": "#/$defs/hex" },
        "border":     { "$ref": "#/$defs/hex" },
        "cta_bg":     { "anyOf": [{ "$ref": "#/$defs/hex" }, { "const": "transparent" }] },
        "cta_text":   { "$ref": "#/$defs/hex" },
        "accent":     { "$ref": "#/$defs/hex" },
        "rule":       { "$ref": "#/$defs/hex" }
      }
    }
  },

  "properties": {
    "_meta": { "type": "object" },

    "brand": {
      "type": "object",
      "required": ["name", "short", "tagline"],
      "properties": {
        "name":        { "type": "string" },
        "short":       { "type": "string" },
        "tagline":     { "type": "string" },
        "positioning": { "type": "string" },
        "founded":     { "type": "integer", "minimum": 1900 },
        "hq":          { "type": "string" },
        "parent":      { "type": "string" }
      }
    },

    "color": {
      "type": "object",
      "required": ["swatch", "role", "fund_theme"],
      "properties": {
        "swatch": {
          "type": "object",
          "additionalProperties": {
            "anyOf": [
              { "$ref": "#/$defs/hex" },
              { "type": "string", "pattern": "^#[0-9A-Fa-f]{8}$" }
            ]
          }
        },
        "role": {
          "type": "object",
          "required": ["dark", "light"],
          "properties": {
            "dark":  { "$ref": "#/$defs/colorRole" },
            "light": { "$ref": "#/$defs/colorRole" }
          }
        },
        "fund_theme": {
          "type": "object",
          "required": ["etf", "cef", "multi_crypto"],
          "additionalProperties": {
            "type": "object",
            "required": ["label", "gradient_top", "gradient_bottom", "accent"],
            "properties": {
              "label":           { "type": "string" },
              "gradient_top":    { "$ref": "#/$defs/hex" },
              "gradient_bottom": { "$ref": "#/$defs/hex" },
              "accent":          { "$ref": "#/$defs/hex" }
            }
          }
        }
      }
    },

    "typography": {
      "type": "object",
      "required": ["primary", "secondary", "scale", "line_height", "letter_spacing", "weight_defaults"],
      "properties": {
        "scale":          { "type": "object", "additionalProperties": { "$ref": "#/$defs/cssLength" } },
        "line_height":    { "type": "object", "additionalProperties": { "type": "string" } },
        "letter_spacing": { "type": "object", "additionalProperties": { "type": "string" } }
      }
    },

    "size":    { "type": "object", "additionalProperties": { "$ref": "#/$defs/rem" } },
    "padding": { "type": "object" },
    "radius":  { "type": "object", "additionalProperties": { "$ref": "#/$defs/cssLength" } },

    "border_width": {
      "type": "object",
      "additionalProperties": { "type": "string", "pattern": "^\\d+px$" }
    },

    "gradient": {
      "type": "object",
      "properties": {
        "_doc": { "type": "string" }
      },
      "additionalProperties": {
        "oneOf": [
          { "$ref": "#/$defs/gradient" },
          {
            "type": "object",
            "required": ["oklab", "srgb"],
            "properties": {
              "direction": { "type": "string" },
              "oklab":     { "$ref": "#/$defs/gradient" },
              "srgb":      { "$ref": "#/$defs/gradient" },
              "stops": {
                "type": "array",
                "items": {
                  "type": "object",
                  "required": ["pos", "hex"],
                  "properties": {
                    "pos": { "type": "string", "pattern": "^-?\\d+(\\.\\d+)?%$" },
                    "hex": { "type": "string", "pattern": "^#[0-9A-Fa-f]{6,8}$" }
                  }
                }
              }
            }
          }
        ]
      }
    },

    "logo": {
      "type": "object",
      "required": ["primary", "viewbox", "min_width_px"],
      "properties": {
        "primary":      { "type": "string" },
        "viewbox":      { "type": "string" },
        "clearspace":   { "type": "string" },
        "min_width_px": { "type": "integer", "minimum": 1 }
      }
    },

    "voice": {
      "type": "object",
      "required": ["tone", "signature_phrases", "do", "dont"],
      "properties": {
        "tone":              { "type": "string" },
        "signature_phrases": { "type": "array", "items": { "type": "string" } },
        "do":                { "type": "array", "items": { "type": "string" } },
        "dont":              { "type": "array", "items": { "type": "string" } }
      }
    },

    "products": { "type": "object" },
    "social":   { "type": "object" },
    "contact":  { "type": "object" },

    "disclaimer": {
      "type": "object",
      "required": ["standard"],
      "properties": {
        "standard": { "type": "string" },
        "footer":   { "type": "string" }
      }
    }
  }
}
